{"id":"magnesium_mg","slug":"magnesium","canonicalName":"Magnesium","aliases":[],"groupId":"minerals_electrolytes","canonicalUnit":"mg","foodDataNutrientIds":["magnesium_mg"],"essentiality":"essential","displayKind":"mineral","status":"published","contentStatus":"complete_for_mvp","summary":"Magnesium supports muscle and nerve function and contributes to protein, bone and DNA production.","forms":[],"functions":[{"title":"Physiological role","description":"Magnesium supports muscle and nerve function and contributes to protein, bone and DNA production.","sourceIds":["nih_ods_fact_sheets"]},{"title":"Food context","description":"Legumes, nuts, seeds, whole grains and leafy vegetables provide magnesium.","sourceIds":["nih_ods_fact_sheets"]}],"referenceValues":[{"frameworkId":"fda_dv_adult_4_plus","valueType":"DV","population":{"ageMinMonths":48,"ageMaxMonths":null,"sex":"all","lifeStage":"general"},"value":420,"unit":"mg","basis":"label_reference","sourceId":"fda_daily_values","status":"source_verified","notes":"FDA label reference for adults and children aged 4+. Not a personalised target, EAR, RDA or UL."}],"foodSourceRules":[{"rankingBasis":"per_100g","phase07NutrientId":"magnesium_mg","minimumDataStatus":"measured_or_calculated","status":"enabled","notes":"Comparable source-backed composition per 100 g; not a health score or a measure of individual absorption."}],"absorptionFactors":[{"factorType":"other","description":"Different supplement salts can differ in absorption; a food-composition amount does not measure how much a person absorbs.","direction":"context_dependent","sourceIds":["nih_ods_fact_sheets"]}],"deficiency":{"overview":"Sustained low intake or conditions affecting absorption and losses can lead to magnesium deficiency; short-term low intake may have no obvious symptoms.","riskGroups":[],"signsAndSymptoms":[],"medicalBoundary":"Symptoms are nonspecific and cannot diagnose a nutrient deficiency. Diagnosis may require clinical evaluation and appropriate laboratory testing.","sourceIds":["nih_ods_fact_sheets"]},"excess":{"overview":"High supplemental or medicinal magnesium can cause diarrhoea and cramping; extremely high intake can disrupt heart rhythm. The supplemental upper limit excludes magnesium naturally present in food.","riskGroups":[],"signsAndSymptoms":[],"medicalBoundary":"An upper limit is not an intake goal. Seek medical or professional advice before changing supplement or medication use.","sourceIds":["nih_ods_fact_sheets"]},"interactions":[],"athleticRelevance":[],"claims":[{"claimId":"claim_magnesium_mg_role","text":"Magnesium supports muscle and nerve function and contributes to protein, bone and DNA production.","category":"function","evidenceLevel":"authoritative_reference","population":"General consumer education; individual diagnosis, medication and supplement decisions remain clinical","sourceIds":["nih_ods_fact_sheets"],"limitations":"Brief NIH ODS consumer education; no performance benefit or personal deficiency is inferred.","reviewStatus":"approved"},{"claimId":"claim_magnesium_mg_food","text":"Legumes, nuts, seeds, whole grains and leafy vegetables provide magnesium.","category":"function","evidenceLevel":"authoritative_reference","population":"General consumer education; individual diagnosis, medication and supplement decisions remain clinical","sourceIds":["nih_ods_fact_sheets"],"limitations":"Brief NIH ODS consumer education; no performance benefit or personal deficiency is inferred.","reviewStatus":"approved"},{"claimId":"claim_magnesium_mg_absorption","text":"Different supplement salts can differ in absorption; a food-composition amount does not measure how much a person absorbs.","category":"absorption","evidenceLevel":"authoritative_reference","population":"General consumer education; individual diagnosis, medication and supplement decisions remain clinical","sourceIds":["nih_ods_fact_sheets"],"limitations":"Brief NIH ODS consumer education; no performance benefit or personal deficiency is inferred.","reviewStatus":"approved"},{"claimId":"claim_magnesium_mg_deficiency","text":"Sustained low intake or conditions affecting absorption and losses can lead to magnesium deficiency; short-term low intake may have no obvious symptoms.","category":"deficiency","evidenceLevel":"authoritative_reference","population":"General consumer education; individual diagnosis, medication and supplement decisions remain clinical","sourceIds":["nih_ods_fact_sheets"],"limitations":"Brief NIH ODS consumer education; no performance benefit or personal deficiency is inferred.","reviewStatus":"approved"},{"claimId":"claim_magnesium_mg_excess","text":"High supplemental or medicinal magnesium can cause diarrhoea and cramping; extremely high intake can disrupt heart rhythm. The supplemental upper limit excludes magnesium naturally present in food.","category":"excess","evidenceLevel":"authoritative_reference","population":"General consumer education; individual diagnosis, medication and supplement decisions remain clinical","sourceIds":["nih_ods_fact_sheets"],"limitations":"Brief NIH ODS consumer education; no performance benefit or personal deficiency is inferred.","reviewStatus":"approved"}],"sources":[{"sourceId":"nih_ods_fact_sheets","locator":"https://ods.od.nih.gov/factsheets/magnesium-Consumer/","accessedAt":"2026-10-05","notes":"Consumer fact sheet updated 2021-03-22; source-linked machine verification, no independent human review."},{"sourceId":"fda_daily_values","locator":"https://www.fda.gov/food/nutrition-facts-label/daily-value-nutrition-and-supplement-facts-labels","accessedAt":"2026-10-05","notes":"FDA-DV-web-snapshot-2026-10-05; repository snapshot identifier, not an official FDA release number. Reference Guide table."}],"editorial":{"reviewStatus":"approved","reviewedAt":"2026-10-05","reviewer":"Codex source verification and machine validation; personal use; no human review","notes":"published_personal_use. Brief source-linked education with mandatory clinical boundaries. No independent human/clinical review or personal intake prescription."}}
