{"id":"selenium_ug","slug":"selenium","canonicalName":"Selenium","aliases":[],"groupId":"minerals_electrolytes","canonicalUnit":"µg","foodDataNutrientIds":["selenium_ug"],"essentiality":"essential","displayKind":"mineral","status":"published","contentStatus":"complete_for_mvp","summary":"Selenium supports thyroid function, reproduction, DNA production and cellular protection.","forms":[{"id":"selenomethionine","name":"Selenomethionine","relationship":"supplement_form","sourceIds":["nih_ods_fact_sheets"]},{"id":"sodium_selenite","name":"Sodium selenite","relationship":"supplement_form","sourceIds":["nih_ods_fact_sheets"]},{"id":"sodium_selenate","name":"Sodium selenate","relationship":"supplement_form","sourceIds":["nih_ods_fact_sheets"]}],"functions":[{"title":"Physiological role","description":"Selenium supports thyroid function, reproduction, DNA production and cellular protection.","sourceIds":["nih_ods_fact_sheets"]}],"referenceValues":[{"frameworkId":"fda_dv_adult_4_plus","valueType":"DV","population":{"ageMinMonths":48,"ageMaxMonths":null,"sex":"all","lifeStage":"general"},"value":55,"unit":"µg","basis":"label_reference","sourceId":"fda_daily_values","status":"source_verified","notes":"FDA adult/children 4+ label reference. Not a personal target, EAR, RDA or UL. Exact source form; no conversion inferred."}],"foodSourceRules":[{"rankingBasis":"per_100g","phase07NutrientId":"selenium_ug","minimumDataStatus":"measured_or_calculated","status":"enabled","notes":"Exact source-backed 100 g profiles; missing composition is not zero."}],"absorptionFactors":[],"deficiency":{"overview":"Dialysis, HIV and diets based on plants grown in low-selenium soil are risk contexts. Deficiency is rare in the United States and Canada.","riskGroups":[],"signsAndSymptoms":[],"medicalBoundary":"Symptoms are nonspecific and cannot diagnose a nutrient deficiency. Diagnosis may require clinical evaluation and appropriate laboratory testing.","sourceIds":["nih_ods_fact_sheets"]},"excess":{"overview":"Excess selenium can harm hair, nails and the nervous system; extreme exposure can be severe. US and European upper-limit frameworks differ and are not intake goals.","riskGroups":[],"signsAndSymptoms":[],"medicalBoundary":"No upper limit is an intake goal. Seek professional or medical advice before changing supplement or medication use.","sourceIds":["nih_ods_fact_sheets"]},"interactions":[{"type":"nutrient_medication","counterparty":"Medicines discussed in the linked NIH ODS fact sheet","description":"Cisplatin can lower selenium levels; ODS states that the effect on the body is unclear. Discuss cancer-treatment and supplement decisions with the treating team.","severity":"professional_review","sourceIds":["nih_ods_fact_sheets"],"limitations":"Informational summary, not a complete interaction list or an instruction to change medicines."}],"athleticRelevance":[],"claims":[{"claimId":"claim_selenium_ug_function","text":"Selenium supports thyroid function, reproduction, DNA production and cellular protection.","category":"function","evidenceLevel":"authoritative_reference","population":"General NIH ODS consumer education; not an individual assessment or athlete supplement protocol","sourceIds":["nih_ods_fact_sheets"],"limitations":"Brief source-linked education. No diagnosis, personal intake target or performance benefit is inferred.","reviewStatus":"approved"},{"claimId":"claim_selenium_ug_food_source","text":"ODS lists seafood, meat, poultry, eggs, dairy, grains, legumes and nuts. Soil selenium affects plant-food composition.","category":"food_source","evidenceLevel":"authoritative_reference","population":"General NIH ODS consumer education; not an individual assessment or athlete supplement protocol","sourceIds":["nih_ods_fact_sheets"],"limitations":"Brief source-linked education. No diagnosis, personal intake target or performance benefit is inferred.","reviewStatus":"approved"},{"claimId":"claim_selenium_ug_deficiency","text":"Dialysis, HIV and diets based on plants grown in low-selenium soil are risk contexts. Deficiency is rare in the United States and Canada.","category":"deficiency","evidenceLevel":"authoritative_reference","population":"General NIH ODS consumer education; not an individual assessment or athlete supplement protocol","sourceIds":["nih_ods_fact_sheets"],"limitations":"Brief source-linked education. No diagnosis, personal intake target or performance benefit is inferred.","reviewStatus":"approved"},{"claimId":"claim_selenium_ug_excess","text":"Excess selenium can harm hair, nails and the nervous system; extreme exposure can be severe. US and European upper-limit frameworks differ and are not intake goals.","category":"excess","evidenceLevel":"authoritative_reference","population":"General NIH ODS consumer education; not an individual assessment or athlete supplement protocol","sourceIds":["nih_ods_fact_sheets"],"limitations":"Brief source-linked education. No diagnosis, personal intake target or performance benefit is inferred.","reviewStatus":"approved"},{"claimId":"claim_selenium_ug_interaction","text":"Cisplatin can lower selenium levels; ODS states that the effect on the body is unclear. Discuss cancer-treatment and supplement decisions with the treating team.","category":"interaction","evidenceLevel":"authoritative_reference","population":"General NIH ODS consumer education; not an individual assessment or athlete supplement protocol","sourceIds":["nih_ods_fact_sheets"],"limitations":"Brief source-linked education. No diagnosis, personal intake target or performance benefit is inferred.","reviewStatus":"approved"}],"sources":[{"sourceId":"nih_ods_fact_sheets","locator":"https://ods.od.nih.gov/factsheets/Selenium-Consumer/","accessedAt":"2026-10-07","notes":"Individually read consumer page; source updated 2025-06-18. No numeric intake rows imported. See the source for framework-specific recommendations."},{"sourceId":"fda_daily_values","locator":"https://www.fda.gov/food/nutrition-facts-label/daily-value-nutrition-and-supplement-facts-labels","accessedAt":"2026-10-08","notes":"FDA-DV-web-snapshot-2026-10-08; repository transcription, not an official FDA release number. Exact Current Daily Value table; adult/children 4+ labeling scope. Original seven-row October 5 snapshot retained separately."}],"editorial":{"reviewStatus":"approved","reviewedAt":"2026-10-07","reviewer":"Codex source verification and machine validation; personal use; no human review","notes":"published_personal_use. Brief source-linked education, no independent human/clinical review and no personal intake prescription."}}
