{"id":"omega_3_g","slug":"omega-3-fatty-acids","canonicalName":"Omega-3 fatty acids","aliases":["n-3 fatty acids","omega 3"],"groupId":"macronutrients","canonicalUnit":"g","foodDataNutrientIds":["omega_3_g"],"essentiality":"essential_family","displayKind":"fat_component","status":"published","contentStatus":"complete_for_mvp","summary":"Omega-3 fatty acids include ALA, EPA and DHA and contribute to cell membranes. These forms are not interchangeable intake targets.","forms":[],"functions":[{"title":"Physiological role","description":"Omega-3 fatty acids include ALA, EPA and DHA and contribute to cell membranes. These forms are not interchangeable intake targets.","sourceIds":["nih_ods_fact_sheets"]}],"referenceValues":[],"foodSourceRules":[{"rankingBasis":"qualitative_only","phase07NutrientId":null,"minimumDataStatus":"measured_or_calculated","status":"disabled","notes":"Total omega-3 composition is unavailable; individual ALA, EPA and DHA values are not inferred or conflated."}],"absorptionFactors":[{"factorType":"form_difference","description":"The body converts only small amounts of ALA to EPA and DHA. No conversion percentage or total omega-3 composition is inferred.","direction":"context_dependent","sourceIds":["nih_ods_fact_sheets"]}],"deficiency":{"overview":"ODS describes deficiency as rare in the United States. Skin symptoms cannot diagnose it; reference amounts for ALA do not establish an EPA/DHA target.","riskGroups":[],"signsAndSymptoms":[],"medicalBoundary":"Symptoms are nonspecific and cannot diagnose a nutrient deficiency. Diagnosis may require clinical evaluation and appropriate laboratory testing.","sourceIds":["nih_ods_fact_sheets"]},"excess":{"overview":"Omega-3 supplements can cause gastrointestinal and other adverse effects; source safety limits are not a personal dosing goal.","riskGroups":[],"signsAndSymptoms":[],"medicalBoundary":"No upper limit is an intake goal. Seek professional or medical advice before changing supplement or medication use.","sourceIds":["nih_ods_fact_sheets"]},"interactions":[{"type":"nutrient_medication","counterparty":"Medicines discussed in the linked NIH ODS fact sheet","description":"High supplemental amounts can increase bleeding problems with warfarin or other anticoagulants; seek professional review.","severity":"professional_review","sourceIds":["nih_ods_fact_sheets"],"limitations":"Informational summary, not a complete interaction list or an instruction to change medicines."}],"athleticRelevance":[],"claims":[{"claimId":"claim_omega_3_g_function","text":"Omega-3 fatty acids include ALA, EPA and DHA and contribute to cell membranes. These forms are not interchangeable intake targets.","category":"function","evidenceLevel":"authoritative_reference","population":"General NIH ODS consumer education; not an individual assessment or athlete supplement protocol","sourceIds":["nih_ods_fact_sheets"],"limitations":"Brief source-linked education. No diagnosis, personal intake target or performance benefit is inferred.","reviewStatus":"approved"},{"claimId":"claim_omega_3_g_food_source","text":"ODS lists seafood, flaxseed, chia, walnuts and some plant oils; algal oils provide a vegetarian supplement source.","category":"food_source","evidenceLevel":"authoritative_reference","population":"General NIH ODS consumer education; not an individual assessment or athlete supplement protocol","sourceIds":["nih_ods_fact_sheets"],"limitations":"Brief source-linked education. No diagnosis, personal intake target or performance benefit is inferred.","reviewStatus":"approved"},{"claimId":"claim_omega_3_g_deficiency","text":"ODS describes deficiency as rare in the United States. Skin symptoms cannot diagnose it; reference amounts for ALA do not establish an EPA/DHA target.","category":"deficiency","evidenceLevel":"authoritative_reference","population":"General NIH ODS consumer education; not an individual assessment or athlete supplement protocol","sourceIds":["nih_ods_fact_sheets"],"limitations":"Brief source-linked education. No diagnosis, personal intake target or performance benefit is inferred.","reviewStatus":"approved"},{"claimId":"claim_omega_3_g_excess","text":"Omega-3 supplements can cause gastrointestinal and other adverse effects; source safety limits are not a personal dosing goal.","category":"excess","evidenceLevel":"authoritative_reference","population":"General NIH ODS consumer education; not an individual assessment or athlete supplement protocol","sourceIds":["nih_ods_fact_sheets"],"limitations":"Brief source-linked education. No diagnosis, personal intake target or performance benefit is inferred.","reviewStatus":"approved"},{"claimId":"claim_omega_3_g_interaction","text":"High supplemental amounts can increase bleeding problems with warfarin or other anticoagulants; seek professional review.","category":"interaction","evidenceLevel":"authoritative_reference","population":"General NIH ODS consumer education; not an individual assessment or athlete supplement protocol","sourceIds":["nih_ods_fact_sheets"],"limitations":"Brief source-linked education. No diagnosis, personal intake target or performance benefit is inferred.","reviewStatus":"approved"},{"claimId":"claim_omega_3_g_absorption","text":"The body converts only small amounts of ALA to EPA and DHA. No conversion percentage or total omega-3 composition is inferred.","category":"absorption","evidenceLevel":"authoritative_reference","population":"General NIH ODS consumer education; not an individual assessment or athlete supplement protocol","sourceIds":["nih_ods_fact_sheets"],"limitations":"Brief source-linked education. No diagnosis, personal intake target or performance benefit is inferred.","reviewStatus":"approved"}],"sources":[{"sourceId":"nih_ods_fact_sheets","locator":"https://ods.od.nih.gov/factsheets/Omega3FattyAcids-Consumer/","accessedAt":"2026-10-07","notes":"Individually read consumer page; source updated 2022-07-18. No numeric intake rows imported. See the source for framework-specific recommendations."}],"editorial":{"reviewStatus":"approved","reviewedAt":"2026-10-07","reviewer":"Codex source verification and machine validation; personal use; no human review","notes":"published_personal_use. Brief source-linked education, no independent human/clinical review and no personal intake prescription."}}
